{
  "protocolVersion": "1.1",
  "commandName": "pyronaut-install",
  "commandVersion": "0.1.0-SNAPSHOT",
  "supportedCommands": [
    "install"
  ],
  "features": {
    "jsonOutput": true,
    "offlineMode": true,
    "dryRun": false,
    "nativeBuild": false,
    "nativeImageArgPassthrough": false,
    "debugVm": false,
    "testSelectors": false,
    "tuiDelegation": false,
    "platforms": [
      "darwin-amd64",
      "darwin-aarch64",
      "linux-amd64",
      "linux-aarch64"
    ]
  }
}
